{
  "schemaVersion": "1.0",
  "display": {
    "churchName": "Sample Community Church",
    "appLabel": "SCC",
    "logoAssetRef": "asset:brand/scc/logo",
    "iconAssetRef": "asset:brand/scc/icon"
  },
  "colors": {
    "primary": "#163A5F",
    "onPrimary": "#FFFFFF",
    "secondary": "#875C00",
    "onSecondary": "#FFFFFF",
    "surface": "#FAFAFA",
    "onSurface": "#171717"
  },
  "navigation": [
    "TODAY",
    "CHURCH",
    "COMMUNITY",
    "MINISTRY",
    "ME"
  ],
  "modules": {
    "church": true,
    "community": true,
    "ministry": true,
    "integrations": true
  },
  "locale": {
    "defaultLocale": "en-US",
    "timezone": "America/Los_Angeles",
    "displayAliases": {
      "COMMUNITY": "Groups",
      "MINISTRY": "Serve"
    }
  },
  "distribution": {
    "mode": "DEDICATED_NATIVE",
    "customDomain": null
  }
}
